18:07:09.099757 IP (tos 0x0, ttl 64, id 12546, offset 0, flags [DF], proto ICMP (1), length 84)
    10.0.0.2 > 10.0.0.1: ICMP echo request, id 10644, seq 1, length 64
18:07:10.108454 IP (tos 0x0, ttl 64, id 12559, offset 0, flags [DF], proto ICMP (1), length 84)
    10.0.0.2 > 10.0.0.1: ICMP echo request, id 10644, seq 2, length 64
18:07:11.121284 IP (tos 0x0, ttl 64, id 12670, offset 0, flags [DF], proto ICMP (1), length 84)
    10.0.0.2 > 10.0.0.1: ICMP echo request, id 10644, seq 3, length 64
18:07:14.189761 ARP, Ethernet (len 6), IPv4 (len 4), Request who-has 10.0.0.1 tell 10.0.0.2, length 28
18:07:14.191807 ARP, Ethernet (len 6), IPv4 (len 4), Reply 10.0.0.1 is-at 00:00:00:00:00:01 (oui Ethernet), length 28
18:07:21.151449 ARP, Ethernet (len 6), IPv4 (len 4), Request who-has 10.0.0.3 tell 10.0.0.1, length 28
18:07:25.282377 ARP, Ethernet (len 6), IPv4 (len 4), Request who-has 10.0.0.3 tell 10.0.0.2, length 28
18:07:25.285818 ARP, Ethernet (len 6), IPv4 (len 4), Reply 10.0.0.3 is-at 00:00:00:00:00:03 (oui Ethernet), length 28
18:07:25.285824 IP (tos 0x0, ttl 64, id 24416, offset 0, flags [DF], proto ICMP (1), length 84)
    10.0.0.2 > 10.0.0.3: ICMP echo request, id 10694, seq 1, length 64
18:07:26.318563 IP (tos 0x0, ttl 64, id 24627, offset 0, flags [DF], proto ICMP (1), length 84)
    10.0.0.2 > 10.0.0.3: ICMP echo request, id 10694, seq 2, length 64
18:07:27.339023 IP (tos 0x0, ttl 64, id 24694, offset 0, flags [DF], proto ICMP (1), length 84)
    10.0.0.2 > 10.0.0.3: ICMP echo request, id 10694, seq 3, length 64
18:07:30.322621 ARP, Ethernet (len 6), IPv4 (len 4), Request who-has 10.0.0.2 tell 10.0.0.3, length 28
18:07:30.322629 ARP, Ethernet (len 6), IPv4 (len 4), Reply 10.0.0.2 is-at 00:00:00:00:00:02 (oui Ethernet), length 28
